{
  "schema_version": "1",
  "program": {
    "id": "tailtrail-enterprise-stabilization",
    "title": "TailTrail Enterprise Stabilization Program",
    "authority_document": "ENTERPRISE-READINESS-ASSESSMENT.md",
    "current_phase": "E6",
    "default_owner": "tailtrail-core",
    "feature_freeze": {
      "state": "active",
      "until_phase": "E12",
      "allowed_change_classes": [
        "compatibility",
        "correctness",
        "evidence",
        "packaging",
        "release",
        "security",
        "support"
      ]
    }
  },
  "candidate_baseline": {
    "captured_at": "2026-10-14",
    "git_commit": "74b9fa25a31aed8b7c8dab13dc0e46b4b2bbc74a",
    "branch": "tailtrail_v3",
    "worktree_state": "dirty-explicitly-classified",
    "release_candidate_state": "blocked",
    "declaration": "E0-E4 are closed. E5 and the PM-6 enterprise conformance implementation are locally verified. The seven-part installation experience plus automatic AIDLC-authority plan detail and comprehensive closure reporting, and the maturity-gating/harness-trend-tracking feature at HEAD, are included in this dirty candidate, which also carries a local, uncommitted batch of pre-existing test-suite defect fixes (installer path-safety, installer/registry drift, and a new focused maturity-lookup test file) not yet folded into a committed baseline. Validation: python3 scripts/enterprise-readiness.py validate; python3 scripts/smoke-test.py; python3 -m unittest tests.test_installation_experience tests.test_transactional_installer. Hosted support remains evidence-blocked until one commit has all six Linux/macOS/Windows x CPython 3.12/3.13 receipts, current real-host receipts, and an observed identity-attested publication receipt. Configured workflows, offline verification, and local evidence are not represented as hosted support. Product-maturity PM-0 through PM-7 and learning PM-L0 through PM-L5 remain subject to the active feature freeze. PM-7 is protocol-ready; genuine usability evidence remains unobserved and no adoption claim is made.",
    "untracked_dispositions": [
      {"path": "tests/test_maturity.py", "disposition": "include", "owner": "tailtrail-core", "reason": "Focused lookup/default/gating-flag proof for the maturity-gating registry feature, added to satisfy the registry's implemented-feature test requirement."},
      {"path": "aidlc-docs/phase-installation-experience-design.md", "disposition": "include", "owner": "tailtrail-install", "reason": "Approved seven-part installation experience architecture and evidence boundary."},
      {"path": "aidlc-docs/phase-installation-experience-requirements.md", "disposition": "include", "owner": "tailtrail-install", "reason": "Approved seven-part installation experience requirements."},
      {"path": "release-channel-v1.json", "disposition": "include", "owner": "tailtrail-release", "reason": "Trusted release discovery metadata without a publication claim."},
      {"path": "schemas/release-channel.schema.json", "disposition": "include", "owner": "tailtrail-release", "reason": "Closed trusted release channel contract."},
      {"path": "schemas/release-publication-receipt.schema.json", "disposition": "include", "owner": "tailtrail-release", "reason": "Closed observed identity-verified publication receipt contract."},
      {"path": "schemas/intent-envelope.schema.json", "disposition": "include", "owner": "tailtrail-core", "reason": "Closed typed natural-intent resolution contract for agent, CLI, MCP, and non-agent clients."},
      {"path": "schemas/debug-preflight.schema.json", "disposition": "include", "owner": "tailtrail-core", "reason": "Closed artifact-first Debug preflight packet and typed behavior-trace contract."},
      {"path": "schemas/debug-host-diagnosis.schema.json", "disposition": "include", "owner": "tailtrail-hosts", "reason": "Closed current-hash-bound public host diagnosis contract shared by Codex, Copilot, and Claude."},
      {"path": "scripts/debug-preflight.py", "disposition": "include", "owner": "tailtrail-core", "reason": "Read-only artifact-first discovery, symbol slicing, behavior-chain tracing, focused-proof selection, and reusable packet generation."},
      {"path": "scripts/debug-host-diagnosis.py", "disposition": "include", "owner": "tailtrail-hosts", "reason": "Validates one host reasoning pass against current source hashes and rejects unsupported ownership, checks, trace edges, and authority claims."},
      {"path": "tests/test_debug_preflight.py", "disposition": "include", "owner": "tailtrail-core", "reason": "Focused artifact ordering, ownership-chain, proof, configuration, freshness, URL safety, and reuse-key regression proof."},
      {"path": "NAVIGATOR-EVIDENCE-FIRST-SCOPE-IMPLEMENTATION-PLAN.md", "disposition": "include", "owner": "tailtrail-core", "reason": "Approved NS-0 through NS-9 evidence-first Navigator scope authority and implementation plan."},
      {"path": "NAVIGATOR-FALSE-STOP-REMEDIATION-PLAN.md", "disposition": "include", "owner": "tailtrail-core", "reason": "FSR-0 through FSR-7 false-stop remediation architecture, phased implementation status, and validation boundary."},
      {"path": "fsr7-real-run-evidence/copilot-2026-09-04/installed-release-proof-report.json", "disposition": "include", "owner": "tailtrail-core", "reason": "FSR-7 installed real-run evidence captured against a real wheel/sdist built from this checkout; all thirteen installed-release-proof checks passed."},
      {"path": "schemas/navigator-installed-release-proof.schema.json", "disposition": "include", "owner": "tailtrail-core", "reason": "FSR-7 closed installed-release-proof report contract separating installation integrity from Navigator behavioral proof."},
      {"path": "scripts/navigator-installed-release-proof.py", "disposition": "include", "owner": "tailtrail-core", "reason": "FSR-7 installed real-run validation: builds/verifies real wheel+sdist, installs Codex/Copilot/Claude payloads, and runs the incident-style Start scenario through the installed Codex launcher."},
      {"path": "tests/test_navigator_installed_release.py", "disposition": "include", "owner": "tailtrail-core", "reason": "FSR-7 scenario/schema/CLI-route fail-closed proof for the installed-release-proof contract."},
      {"path": "tests/test_token_telemetry.py", "disposition": "include", "owner": "tailtrail-core", "reason": "Focused exact host/API token usage ingestion and rejection proof."},
      {"path": "TAILTRAIL-STOP-RESUME-CONTROL-IMPLEMENTATION-PLAN.md", "disposition": "include", "owner": "tailtrail-core", "reason": "Implemented common stop/resume control design and closed lifecycle contract."},
      {"path": "schemas/tailtrail-session-attachment.schema.json", "disposition": "include", "owner": "tailtrail-core", "reason": "Closed durable session attachment, detach, and exact-run resume contract."},
      {"path": "scripts/session-control.py", "disposition": "include", "owner": "tailtrail-core", "reason": "Packaged CLI wrapper for common TailTrail session stop, resume, and status control."},
      {"path": "scripts/session_control.py", "disposition": "include", "owner": "tailtrail-core", "reason": "Common fail-closed session attachment and stop/resume lifecycle service."},
      {"path": "tests/test_session_control.py", "disposition": "include", "owner": "tailtrail-core", "reason": "Focused durable session-state, integrity, idempotence, and late-result guard proof."},
      {"path": "tests/test_tailtrail_stop_resume.py", "disposition": "include", "owner": "tailtrail-core", "reason": "End-to-end CLI, intent, workflow, and exact-run stop/resume proof."},
      {"path": "schemas/navigator-scope-baseline.schema.json", "disposition": "include", "owner": "tailtrail-core", "reason": "NS-0 closed privacy-safe known-gap baseline contract."},
      {"path": "schemas/navigator-scope-evidence.schema.json", "disposition": "include", "owner": "tailtrail-core", "reason": "NS-2/FSR-3/FSR-4 typed repository-role, candidate-status, provenance, bounded behavior-chain, separated limit/decision diagnostics, and fingerprint contract."},
      {"path": "schemas/navigator-host-scope-proposal.schema.json", "disposition": "include", "owner": "tailtrail-core", "reason": "NS-3/FSR-5 schema-v2 exact packet, scope, target, goal, requirement, candidate, content-hash, edge, uncertainty, and no-authority host proposal contract."},
      {"path": "schemas/navigator-scope-quality.schema.json", "disposition": "include", "owner": "tailtrail-core", "reason": "NS-4/FSR-4 fail-closed role gate, three-option evidence-validated question, primary reason, and atomic Start scope-quality contract."},
      {"path": "schemas/requirement-interpretation.schema.json", "disposition": "include", "owner": "tailtrail-core", "reason": "Closed exact-goal-bound host requirement interpretation contract with typed clause roles, literal separation, grounding, and no-private-reasoning enforcement."},
      {"path": "schemas/requirement-sufficiency.schema.json", "disposition": "include", "owner": "tailtrail-core", "reason": "Closed requirement-sufficiency and material-decision contract evaluated before implementation scope."},
      {"path": "schemas/canonical-requirement-set.schema.json", "disposition": "include", "owner": "tailtrail-core", "reason": "Closed pre-scope canonical requirement identity shared by query framing, planning, hands-free sequencing, and approval."},
      {"path": "schemas/requirement-intake.schema.json", "disposition": "include", "owner": "tailtrail-core", "reason": "Closed append-only pre-lock requirement intake and answer revision contract."},
      {"path": "schemas/requirement-evidence-assistance.schema.json", "disposition": "include", "owner": "tailtrail-core", "reason": "Closed bounded repository-evidence assistance contract that cannot answer for the user or prove implementation ownership."},